{
  "$schema": "https://json-schema.org/draft/2020-12/schema",
  "$id": "https://github.com/kylecheng3146/agent-ops/schemas/task.schema.json",
  "title": "Agent Ops task",
  "type": "object",
  "additionalProperties": false,
  "required": [
    "schemaVersion",
    "id",
    "title",
    "criteria"
  ],
  "properties": {
    "schemaVersion": {
      "enum": [
        1,
        2
      ]
    },
    "id": {
      "$ref": "#/$defs/id"
    },
    "title": {
      "$ref": "#/$defs/nonEmptyString"
    },
    "intent": {
      "$ref": "#/$defs/nonEmptyString"
    },
    "parentTaskId": {
      "$ref": "#/$defs/id"
    },
    "criteria": {
      "type": "array",
      "minItems": 2,
      "maxItems": 5,
      "items": {
        "type": "object",
        "additionalProperties": false,
        "required": [
          "id",
          "description",
          "verifierIds"
        ],
        "properties": {
          "id": {
            "$ref": "#/$defs/id"
          },
          "description": {
            "$ref": "#/$defs/nonEmptyString"
          },
          "verifierIds": {
            "type": "array",
            "minItems": 0,
            "uniqueItems": true,
            "items": {
              "$ref": "#/$defs/id"
            }
          },
          "acceptance": {
            "type": "object",
            "additionalProperties": false,
            "required": [
              "mode",
              "baselineCommit",
              "bindings"
            ],
            "properties": {
              "mode": {
                "enum": [
                  "behavioral",
                  "invariant",
                  "review-only"
                ]
              },
              "baselineCommit": {
                "type": "string",
                "pattern": "^(?:[a-f0-9]{40}|[a-f0-9]{64})$"
              },
              "reviewOnlyReason": {
                "type": "string",
                "minLength": 1,
                "maxLength": 4096,
                "pattern": "\\S"
              },
              "bindings": {
                "type": "array",
                "maxItems": 64,
                "items": {
                  "type": "object",
                  "additionalProperties": false,
                  "required": [
                    "runnerId",
                    "checkIds",
                    "materials"
                  ],
                  "properties": {
                    "runnerId": {
                      "$ref": "#/$defs/id"
                    },
                    "checkIds": {
                      "type": "array",
                      "maxItems": 512,
                      "uniqueItems": true,
                      "items": {
                        "type": "string",
                        "minLength": 1
                      },
                      "minItems": 1
                    },
                    "redCheckIds": {
                      "type": "array",
                      "maxItems": 512,
                      "uniqueItems": true,
                      "items": {
                        "type": "string",
                        "minLength": 1
                      }
                    },
                    "materials": {
                      "type": "array",
                      "minItems": 1,
                      "maxItems": 512,
                      "items": {
                        "type": "object",
                        "additionalProperties": false,
                        "required": [
                          "path",
                          "role"
                        ],
                        "properties": {
                          "path": {
                            "type": "string",
                            "minLength": 1,
                            "maxLength": 4096,
                            "pattern": "^[^/\\\\\\u0000]+(?:/[^/\\\\\\u0000]+)*$",
                            "not": {
                              "anyOf": [
                                {
                                  "pattern": "(?:^|/)(?:\\.{1,2}|\\.git|\\.agent-ops|node_modules)(?:/|$)"
                                },
                                {
                                  "pattern": "^(?:dist|build|\\.tmp)/"
                                },
                                {
                                  "enum": [
                                    "package.json",
                                    "package-lock.json",
                                    "pnpm-lock.yaml",
                                    "yarn.lock",
                                    "Cargo.toml",
                                    "Cargo.lock",
                                    "pyproject.toml"
                                  ]
                                }
                              ]
                            }
                          },
                          "role": {
                            "enum": [
                              "test",
                              "fixture",
                              "helper"
                            ]
                          }
                        }
                      }
                    }
                  }
                }
              }
            },
            "allOf": [
              {
                "if": {
                  "properties": {
                    "mode": {
                      "const": "review-only"
                    }
                  },
                  "type": "object"
                },
                "then": {
                  "required": [
                    "reviewOnlyReason"
                  ],
                  "properties": {
                    "reviewOnlyReason": {
                      "type": "string"
                    },
                    "bindings": {
                      "maxItems": 0,
                      "type": "array"
                    }
                  },
                  "type": "object"
                },
                "else": {
                  "properties": {
                    "reviewOnlyReason": false,
                    "bindings": {
                      "minItems": 1,
                      "type": "array"
                    }
                  },
                  "type": "object"
                }
              }
            ]
          },
          "finding": {
            "type": "object",
            "additionalProperties": false,
            "required": [
              "pinId",
              "reportDigest",
              "findingIndex",
              "candidateCommit",
              "criterionIds"
            ],
            "properties": {
              "pinId": {
                "type": "string",
                "pattern": "^[a-f0-9]{64}$"
              },
              "reportDigest": {
                "type": "string",
                "pattern": "^[a-f0-9]{64}$"
              },
              "findingIndex": {
                "type": "integer",
                "minimum": 0
              },
              "candidateCommit": {
                "type": "string",
                "pattern": "^(?:[a-f0-9]{40}|[a-f0-9]{64})$"
              },
              "criterionIds": {
                "type": "array",
                "maxItems": 512,
                "uniqueItems": true,
                "items": {
                  "type": "string",
                  "minLength": 1
                }
              }
            }
          }
        },
        "allOf": [
          {
            "if": {
              "not": {
                "required": [
                  "acceptance"
                ],
                "properties": {
                  "acceptance": {}
                },
                "type": "object"
              }
            },
            "then": {
              "properties": {
                "verifierIds": {
                  "minItems": 1,
                  "type": "array"
                }
              },
              "type": "object"
            }
          }
        ]
      }
    },
    "goal": {
      "type": "string",
      "minLength": 1,
      "maxLength": 65536
    },
    "contractRevision": {
      "type": "integer",
      "minimum": 0
    },
    "surface": {
      "description": "EVIDENCE-SURFACE-001 audit (axes, included, excluded, unknown, contracts, valueChanges, scenarios) or a child's covers list; validated strictly by the runtime.",
      "type": "object"
    },
    "surfaceRequired": {
      "const": true
    },
    "origin": {
      "description": "Escape Loop origin: {kind: escape-of, commit, label, receipt?} or {kind: pre-existing|external, reason}; validated strictly by the runtime.",
      "type": "object"
    },
    "originRequired": {
      "const": true
    },
    "debug": {
      "type": "object",
      "additionalProperties": false,
      "required": [
        "rootTaskId",
        "facts",
        "unknowns"
      ],
      "properties": {
        "rootTaskId": {
          "type": "string",
          "minLength": 1,
          "maxLength": 4096
        },
        "facts": {
          "type": "array",
          "maxItems": 128,
          "uniqueItems": true,
          "items": {
            "type": "string",
            "minLength": 1,
            "maxLength": 4096
          }
        },
        "unknowns": {
          "type": "array",
          "maxItems": 128,
          "uniqueItems": true,
          "items": {
            "type": "string",
            "minLength": 1,
            "maxLength": 4096
          }
        }
      }
    }
  },
  "$defs": {
    "id": {
      "type": "string",
      "pattern": "^[a-z][a-z0-9-]{0,127}$"
    },
    "nonEmptyString": {
      "type": "string",
      "pattern": "[^\\s\\u0000]",
      "not": {
        "pattern": "\\u0000"
      }
    }
  },
  "$comment": "Criterion ID uniqueness is a semantic constraint enforced by runtime validation.",
  "allOf": [
    {
      "if": {
        "properties": {
          "schemaVersion": {
            "const": 1
          }
        },
        "type": "object"
      },
      "then": {
        "properties": {
          "goal": false,
          "contractRevision": false,
          "criteria": {
            "items": {
              "properties": {
                "acceptance": false,
                "finding": false
              },
              "type": "object"
            },
            "type": "array"
          },
          "debug": false
        },
        "type": "object"
      }
    },
    {
      "if": {
        "required": [
          "debug"
        ],
        "type": "object"
      },
      "then": {
        "required": [
          "goal"
        ],
        "properties": {
          "schemaVersion": {
            "const": 2
          }
        },
        "type": "object"
      }
    }
  ]
}
